domain,sentence
creative,but the sound is very good ( and loud ) and works well on my portable speakers .
creative,and for those that are intrested the recharger works anywhere in the world ( and is quite small ).
creative,the scroll button seems ok  i have no problems with it .
creative,i had all my files already on my pc in wma format ( 200 cd s ).
creative,so far so good  no problems  no conversions .
creative,very simple to use .
creative,the reason it does not get 5 stars
creative,1 ) a spare battery would have been great .
creative,2 ) no games - it has a cool screen - why not use it .
creative,3 ) it does not work automatically like a hard drive when you connect it to your computer  like some players
creative,all in all suprisingly easy to use .
creative,summary :
creative,lots of flaws  but exceptional sound quality  hd size  and price make it a good buy .
creative,excellent sound - i found the music reproduced faithfully through the jukebox .
creative,there was no distortion and it sounded great  especially with eax environmental audio enabled .
creative,transfer through windows explorer - windows recognizes the jukebox as an additional hard disk  so it allows you to simply drag and drop files from windows explorer to a folder for the nomad .
creative,i found this to be a much easier method of transferring my music to the nomad than using their software .
creative,however  it does nt register instantly as a hard drive like other players .
creative,you have to install the software to the computer you re transferring to  instead of just connecting it with a usb connection .
creative,this would have been much easier .
creative,the nomad can hold any type of file  not just mp3  so you can use it as a portable hard disk .
creative,i found it very useful for transferring large files to another computer .
creative,this almost made it worth the price alone .
creative,i was able to easily copy 2gb worth of video files from my computer  and then transfer them to a friend s .
creative,huge storage space - even at 320kbs  you can store a ton of songs on this thing .
creative,30gb is more than enough for most people .
creative,having usb 2.0 makes for very fast transfers .
creative,it only took me about 10 seconds to transfer a 200mb file .
creative,it took maybe 15 minutes to transfer 1000 songs .
creative,navigation system - the zen xtra uses id3 tags that are embedded in the mp3 files to organize your songs .
creative,this is great as long as all of your music have id3 tags  and if you ve downloaded your songs off the internet  many probably do nt .
creative,it would have been much easier to use a windows explorer style navigation system .
creative,you can t simply open up a folder from the player and play all the songs in it .
creative,whe you transfer your songs to the jukebox  it dumps all of them into a single folder  and then sorts them by the id3 tags.
creative,fm receiver - it has none .
creative,i would be nice to have a simple fm receiver so i could pick up local stations .
creative,that way i could get rid of a walkman alltogether .
creative,cheap construction - they should have made the player out of hard plastic and put some rubber on the corners .
creative,the player feels very delicate  as if i m holding an actual hard drive .
creative,i m not sure if it would survive a fall from 3 feet .
creative,as a portable player  it should feel a bit more durable .
creative,the top of the player is a thin metal piece that covers up the battery and is removable .
creative,i could crush this thing in half with two fingers if i wanted to .
creative,this is not a player you can take jogging .
creative,the songs do nt play one after another like on a cd .
creative,you have to add them to the playing list .
creative,i can t simply bring up my entire list of songs  click play  and then hit next .
creative,you have to add all the songs to a play list .
creative,there is probably an easier way to do this  i just have nt found it yet .
creative,software - the software is crap .
creative,i use it for ripping cds  which it does a pretty good job of .
creative,like most people  i do nt want to read the instructions  i just want to use it .
creative,even after reading some of the instructions  it s still hard to figure out .
creative,"i would recommend replacing the existing software with the "" notmad explorer  "" which is simpler to use and can be found on the internet ."
creative,no line out jack - as i said  there is none .
creative,the headphone jack acts as a pseudo line out jack .
creative,so you can plug your nomad directly into your stereo or use a car adapter  but you do nt get the quality from a true line out jack .
creative,it sounds decent  but i would estimate you get maybe 80 % of the quality that you would from a true line out jack .
creative,controls are a bit awkward .
creative,the controls definately took some getting used to .
creative,when i first had it i kept finding myself having to look at the nomad to figure out where the skip button was .
creative,a sliding old fashioned volume knob would also have been easier than the digital version that was included .
creative,i want to have instant access to the volume  not have to hold down a button and have to wait a half second for the player to register it .
creative,crappy headphones .
creative,the included earbuds were uncomfortable .
creative,i would replace them with some better sounding and more comfortable phones .
creative,"difficult navigation - i wo nt necessarily say "" difficult  "" but i do nt enjoy the scrollwheel to navigate ."
creative,it is a bit cumbersome  and i can t get to the songs i want as quickly .
creative,i would much more have preferred a keypad-type navigator like found on dvd remotes .
creative,up  down  left  and right would have given me better control .
creative,"if you hold down the scroll wheel too long ( which is common if you have a lot of songs to sort through )  it will get "" stuck "" rapidly going through the songs and wo nt stop until several seconds after you let your finger off of it ."
creative,case - the nomad comes with a leather holding case .
creative,it would have been much nicer if it had a window so you could see the screen  and if the button did nt cover up the ac jack .
creative,that way i could keep it in the case all the time .
creative,as it stands now  the case is pretty useless unless you re packing the player up for travel  or if you load up all your songs beforehand .
creative,you can cut up the case a bit with an xacto knife and make it useable though .
creative,i am willing to overlook it s problems to get superior sound quality and low price  although i feel the player has a lot of room for improvement .
creative,after looking over multiple large mp3 players  i decided to get this one .
creative,for the price and size and features  you can t beat the price .
creative,a 10 gb ipod is just as much and i have heard from multiple sources that the ipod is very loud and you can heard the hard drive everytime it spins  accesses files or does antyhing .
creative,i think the reson for the creative being larger is for sound dampening and protection  whihc is a plus  but then again it is only speculation .
creative,the buttons and interface are very easy to use .
creative,simple click buttons  back buttons volume and display are very easy to read  access and use .
creative,but the major problem i had was with the software .
creative,you are not able to simply import files  but rather you have to go through multiple steps to find them .
creative,the instructions that come with it do nt explain how to make things simple .
creative,the quick sync is nt any good becuase it either needs to be configured properly or just is nt very useful .
creative,i tried to make sense of the file transfer program and just got more confused .
creative,i tried to take a cd and simply rip it onto a hard drive and then transfer into the player .
creative,well that was not a simple task .
creative,i ended up suing windows player to make mp3 s ( actually wma files ) and then using the probram to transfer .
creative,i think the lack of the mp3 player being able to run without special software is also a downer  becuase it makes it more cumbersome for people less computer illiterate .
creative,buy this for the storage and price  avoid it if you know nothing about computers .
creative,with this mp3 player you get much more memory for much less than an ipod .
creative,an ipod with the same amount of memory is $ 150 cheaper .
creative,"the reason for this the ipod has "" a better user interface "" ."
creative,i have found that the interface on the nomad is very easy to use if you have a basic knowledge of a computer .
creative,also the ipod has games on it .
creative,games are ok for a cell phone  but mp3 s are for music .
creative,i purchased this player last week .
creative,i did a little research on the web and this is the player i decided on .
creative,i refuse to buy anything made by apple and the nomad is about $ 200 cheaper anyway .
creative,i have had no problem what-so-ever with this product .
creative,the software installed flawlessly and without any problems on my windows 2k machine .
creative,the headphones are nt the best  but you can really expect much out of the small headphones you insert in the ear cavity .
creative,the battery life seems good  takes very lttle time to charge  it uploads mp3s quickly and there is no delay between songs .
creative,took me a few tries to get use to the navigation  but it s a very user friendly player imo .
creative,i have nt messed with the firmware at all  the player worked perfect for me right out of the box .
creative,all-in-all  this is another excellent creative product .
creative,if you have the money and need 40 gb  this is the player for you .
creative,i would recommend this product to anyone .
creative,before asking for the zen xtra specifically for christmas i researched many different mp3 players but finally decided on this one  and now that i have it i could nt be happier and i m convinced it s the best one out there .
creative,many people have written about the software being its one downfall  personally i have nt had a single problem with the software  i m running windows me .
creative,the cd ripping to mp3 is so easy  and you can even rip the cd directly to the mp3 player  so it wo nt take up space on your pc hard drive .
creative,the software runs smooth  it s nice to look at  it s very organized  easy to follow and makes things very simple .
creative,the controls on the player are very simple  no need for a manual .
creative,the player is fast and sounds great  it also has many options like slowing or speeding up the music  or making it sound like you re hearing the music in a huge auditorium .
creative,the battery lasts very long when playing music  but writing files to the player drains the battery fast  so you need to have it plugged into an outlet when sending files .
creative,playlists can be made on the fly  without aid of a computer  and you can use play modes like shuffle and repeat for your  now playing  selections or playlists .
creative,the software could nt be better and the mp3 player works like a dream  i could nt give this anything but a 5  i wish there was a 6 .
creative,i purchased and returned this product  but not because of any glaring flaws in the design .
creative,"in fact  everyone who saw it thought i was "" the man "" and wo nt believe i returned it ."
creative,so what s the problem ?
creative,i made the mistake of thinking i could easily manage my mp3 library with this device .
creative,i initially loaded about 3700 tracks with the intent of ripping the majority of my remaining cds to mp3 .
creative,i quickly discovered that the nomad was nt going to work for me .
creative,the reasons below will be true for any product in this category .
creative,here s why :
creative,1 . i do nt need the nomad at the office .
creative,i have my mp3 s stored on my workstation .
creative,2 . i do nt need the nomad at home for the same reason ( although using it to sync between the two pc s might be a reason enough to get it . )
creative,3 . it s a hazard in the car .
creative,the navigation is nice enough  but scrolling and searching through thousands of tracks  hundreds of albums or artists  or even dozens of genres is not conducive to save driving .
creative,( throw a cell phone and you re asking for trouble . ) 3a .
creative,creating playlists using the included software to minimize issue 3 was nt as easy as i would have liked .
creative,the bottom line :
creative,if i have to get into making playlists to avoid rear-end collisions  i ll just buy a regular portable cd/mp3 player and burn myself collections of about 120 tracks per disk .
creative,"sure it s "" old school "" to carry a cd wallet around  but it will be easier to manage and i ll save around 250 bucks ."
creative,one major complaint :
creative,my only significant complaint is sound quality .
creative,the eax sound enhancement feature did nt do enough for me and the custom eq was a limited 5 band eq .
creative,this did not give me enough control .
creative,i wanted to use the nomad with a cassette style car adapter .
creative,"i was unable achieve a sound quality on par with my simple portable cd player with "" bass boost . """
creative,the sound quality of my cd player is superior in this setting to the nomad .
creative,one minor complaint :
creative,the documentation says to extend battery life  do not fill player to capacity .
creative,gee ... thanks a lot creative .
creative,well in the beginning i was asking around for mp3 players .
creative,so then i came across the ipod ( 10 gb ) .
creative,so i was all excited about the ipod but then the day before i went to best buy to check out the other mp3 players and i came across this one .
creative,well i decided to get this one .
creative,well i have to say that this product is very good i mean it might be a little big but it still fits in your pocket .
creative,well surely this is a product that i recommend someone in getting rather than any other mp3 player ( at that size and the price ) .
creative,well just one con - its not really plug and play at first i mean its very confusing to start the program but one you do it  it will be a breeze .
creative,enjoy .
creative,i was going to get a 10gb ipod  but after looking at the 10 day warranty for ipod and www.ipodsdirtysecret.com ( battery lasts 18 months ;
creative,it costs like 200 dollars to replace - now you mail it off to get the battery replaced for like 99 .. .
creative,what a big improvement ... lol ) and the fact that lots of people have had problems with ipods on windows computers  i realized this is a much better buy .
creative,anyway  on with the review .
creative,so far i ve only had it since christmas  so i cant tell you much about the battery life .
creative,it hasnt gone below the second notch ( i charge mine whenever i m at home and not using it )  so the battery life seems fine ( so far ).
creative,software : for the people who complain about software  please  stop complaining .
creative,once you hook the thing up to the computer ( via the usb cable )  the machine instantly recognizes the fact that it s there & installs the drivers .
creative,from there  you transfer files from your computer to the mp3 player ( with the help of the media sniffer .. . read the manual ).
creative,my only complaint would be that you need id3 tags & that takes a while to do if your mp3 files do nt have them .
creative,if you re copying cds with windows media  its really simple to give your songs id3 tags  so thats what i do .
creative,oh ... and file transfers are fast & easy .
creative,the player : it s silver .
creative,a little weighty ( 9 ounces ... no biggie )  but otherwise fine .
creative,people complain about the scroll wheel  but its not a big deal at all ( though it is just a little annoying at times ) .
creative,it s easy .
creative,the buttons are easy to use  and its easy to navigate .
creative,the big backlight makes things easy to see  and the writing is big enough for people to see .
creative,my favorite thing about the nomad is the eax feature .
creative,you can customize bass  etc. like usual  but also you can customize the sound of the player ( like how it would sound in a concert hall  jazz club  etc ).
creative,sound quality is amazing. i was expecting worse  but its really good ( especially if your files have good sound quality ) .
creative,you can also slow a song down & speed it up  which is cool too .
creative,but the earbuds suck !
creative,buy new ones asap. every time you move your face or something they pop out .
creative,for a 250 dollar player  they could have thrown in nice headphones .
creative,a remote would have been cool too ... but lets not push it .
creative,oh ... one more thing .
creative,i forgot  the case does nt fit .
creative,my case doesnt close ... maybe mine was just faulty  but the case isnt that great .
creative,so far the player froze on me once ( i started pushing buttons before it loaded ) but since is hard drive based - you have to expect that .
creative,so all you do is stick a pin or something small in the reset button & you re golden .
creative,hope i helped !
creative,i d like to start off saying that before this product i was using an archos jukebox recorder .. .
creative,what made this product so great to me was the open source os called rockbox .. .
creative,based on hardware one could assume the archos players were horrible ( which by hardware standards .. . they were ) .. .
creative,but because a few fine men and women took the time to create the upstanding rockbox software  the archos became a top notch player for me with intuitive features out the wazoo .. .
creative,now we come to the zen xtra .. .
creative,first i ll start off by saying that this players hardware is pretty good .. .
creative,what really made this a mediocre mp3 player for me was the software .
creative,not just the transfer software ( which was a hellishly horrible experience ) but also the player s software .
creative,first of all  many actions that the player utilizes do nt make sense . .
creative,bookmarks for example  are an excellent feature ... but not on this player .. .
creative,rather than creating a directory for bookmarks to be found in one area  the user must actually find the track where the bookmark was made . .
creative,this makes no sense and sort of defeats the purpose of audio bookmarks .. .
creative,"the dynamic playlists ( "" now playing ""  i belive creative calls it ) feels very awkward at times and some menus simply take to long to get to and operate .. ."
creative,well  anyway i could go on and on on why this player did nt meet my expectations .. .
creative,i ll just say this .. .
creative,for the average music listener not expecting much ... this may be a satisfactory mp3 player ...
creative,but for someone who cares about thier music collection and wants fluid and responsive playback .. . i can t recommend this product .
creative,i became interested in getting a mp3 player when i got a new work computer ; while my office bars the addition of any non-work software  it does nt care if you load cds onto the hard drive .
creative,over time  i loaded hundreds of cds onto the computer  and the idea of carrying around all of my music with me became attractive .
creative,many people recommended the ipod  and i borrowed one from a friend .
creative,also  there is the need to send the ipod to replace the batteries when they die ( which they will ).
creative,i have had the nomad jukebox for about three weeks now  and i am very happy with it .
creative,the storage capacity is great for me --
creative,i have a large but not huge cd collection and have loaded everything i want to listen to on it and still have 13 gigabytes free .
creative,the controls are somewhat harder to use than the ipod  but i have gotten use to them  and even at the beginning did not think would justify the huge difference in price .
creative,i had never loaded my cds on to my home computer  using my work computer instead .
creative,my office would not let me put the software on to my work computer .
creative,this meant that i had to take all my cds and do in a fairly short period of time what i had done over a year at work .
creative,if the music had been on my home computer  the transfer would have been accomplished very quickly .
creative,i have an older computer  running windows 98 se  and so those of you with something more recent would find the process even quicker .
creative,my only reservations about this product concern the tagging process and the way it interacts with the software .
creative,when you load a disc  you go to an internet cite for the insertion of the names for the cd and the tracks .
creative,while the listing process is accurate for track names ( unlike windows  reliance on the amg  which frequently gets track listings out of order )  the results can be odd .
creative,the cd will be classified into a number of genres  and in multidisk sets  you can get separate classifications for different disks by the same artist and the same performance .
creative,for example  jimi hendrix s 2 cd live at the fillmore east had one cd classifed as classic rock and the other psychidelic rock .
creative,perhaps the weirdest was one of bruce springsteen s cds from the tracks set being classified as goth rock .
creative,you can change any of these  but need to be paying attention when the information is downloaded before you copy it .
creative,a somewhat more troublesome problem is that the internet site will sometimes give different discs of the same set slightly different names .
creative,this will cause the discs not to show up together when you are looking for them on the nomad .
creative,again  you can change this  but it s harder to spot a minor variation in the title when you do nt have the title of the other disk in front of you .
creative,other tagging problems result ( i think ) from the nomad s operating system .
creative,if you have two tracks with exactly the same name on one disk  it will not copy both -- it gives you the option of skipping the second or overwriting the first with the second .
creative,this is rarely a problem with any kind of popular music  but can be troublesome with classical music where tracks are identified by tempi .
creative,i also had it happen when recording a jazz set where there were a number of outtakes of the same song without numbering them separately .
creative,the way to fix this is to rename the track by adding a number yourself to the end of the track listing .
creative,"also  i can t understand why the software does not ignore "" the "" when it lists the cds in alphabetical order ."
creative,finally  making playlists from the computer can be complicated because the tracks are listed individually  and are organized by cd  which are not listed but are organized in alphabetical order .
creative,in other words  to locate a track using the software on the computer and add it to a playlist  you must know the name of the cd it appears on and then find the track by locating the location of the unlisted cd by looking for tracks that appear on it .
creative,you do nt have this problem if you make your playlist from the nomad  where cds are listed separately .
creative,you need your computer  however  if you want to add tracks to a playlist .
creative,these are minor problems  and i list them to save anyone else the trouble of discovering them .
creative,had i not been in such a hurry to load cds  i would have spotted them sooner .
creative,also  if i had already loaded and tagged by cds on my home computer  this would not have been an issue .
creative,apple s ipod is dominant now  but i have to wonder whether the price differential will mean that in 3 or 4 years its market share will drop significantly .
creative,simply not as friendly for functional as an ipod .
creative,even better  ipod integrates perfectly with itunes so that managing music is a snap .
creative,i just got a 40gb ipod to replace my zen ( a 20gb model ) .
creative,while the ipod s form factor is much nicer  here s where the zen is better .
creative,a lot of people complain about the creative software  but i actually find creative mediasource organizer to have some strengths over itunes .
creative,first  the zen lets you sync to more than one computer .
creative,the ipod is a one way only machine - from computer to player .
creative,the zen is an outstanding way to shuttle music between sources  you can t do this on the ipod ( except for a cumbersome work-around using the ipod as a hard drive instead of a player ) .
creative,"second  the "" automatic "" sync on creative lets you review the songs before it begins its transfer ."
creative,since the ipod lacks this review feature on its auto-sync and it only allows one-way transfers  the first time i connected my ipod to my laptop  i wiped out the 20gb of music i had transferred from my desktop to the ipod .
creative,if the hard drive on your computer should fail  better have your music backed up somewhere or its gone !
creative,the zen serves as a back-up device as well as a player .
creative,third  creative software allows you to keep two windows open to look at both the content on the player and the computer .
creative,only thing missing from creative is a cd burner .
creative,lastly  ipod / itunes will not play wma formatted songs .
creative,if you have a lot of those  be prepared to convert to mp3 .
creative,itunes does what apple is famous for  makes software that works for the less computer saavy .
creative,for those of us that like to tinker  i think creative offers some advantages .
creative,player controls :
creative,here s where the ipod drives me nuts .
