domain,sentence
restaurants,But the staff was so horrible to us .
restaurants,"To be completely fair  the only redeeming factor was the food  which was above average  but could ""nt"" make up for all the other deficiencies of Teodora ."
restaurants,"The food is uniformly exceptional  with a very capable kitchen which will proudly whip up whatever you feel like eating  whether it ""s"" on the menu or not ."
restaurants,"Not only was the food outstanding  but the little ` perks """" were great ."
restaurants,Our agreed favorite is the orrechiete with sausage and chicken -LRB- usually the waiters are kind enough to split the dish in half so you get to sample both meats -RRB- .
restaurants,The Bagels have an outstanding taste with a terrific texture  both chewy yet not gummy .
restaurants,Nevertheless the food itself is pretty good .
restaurants,"i ""ve"" noticed megadeth  mr. scruff  st. germain  traditional vietnamese songs  black sabbath  jay-z  and daft punk all being played ."
restaurants,They did not have mayonnaise  forgot our toast  left out ingredients -LRB- ie cheese in an omelet -RRB-  below hot temperatures and the bacon was so over cooked it crumbled on the plate when you touched it .
restaurants,It took half an hour to get our check  which was perfect since we could sit  have drinks and talk !
restaurants,The design and atmosphere is just as good .
restaurants,He has visited Thailand and is quite expert on the cuisine .
restaurants,The pizza is the best if you like thin crusted pizza .
restaurants,All the money went into the interior decoration  none of it went to the chefs .
restaurants,The seats are uncomfortable if you are sitting against the wall on wooden benches .
restaurants,I asked for seltzer with lime  no ice .
restaurants,"Do ""nt"" go alone -- even two people is ""nt"" enough for the whole experience  with pickles and a selection of meats and seafoods ."
restaurants,"My suggestion is to eat family style because you ""ll"" want to try the other dishes ."
restaurants,Best of all is the warm vibe  the owner is super friendly and service is fast .
restaurants,"Faan ""s"" got a great concept but a little rough on the delivery ."
restaurants,"From the incredible food  to the warm atmosphere  to the friendly service  this downtown neighborhood spot does ""nt"" miss a beat ."
restaurants,"Great food at REASONABLE prices  makes for an evening that ca ""nt"" be beat !"
restaurants,this little place has a cute interior decor and affordable city prices .
restaurants,Two words : Free wine .
restaurants,The price is reasonable although the service is poor .
restaurants,The quantity is also very good  you will come out satisfied .
restaurants,I stumbled upon this second floor walk-up two Fridays ago when I was with two friends in town from L.A. Being serious sushi lovers  we sat at the sushi bar to be closer to the action .
restaurants,The fried rice is amazing here .
restaurants,Three courses - choices include excellent mussels  puff pastry goat cheese and salad with a delicious dressing  and a hanger steak au poivre that is out of this world .
restaurants,"it ""s"" a perfect place to have a amanzing indian food ."
restaurants,The place is so cool and the service is prompt and curtious .
restaurants,"At the end you ""re"" left with a mild broth with noodles that you can slurp out of a cup ."
restaurants,I just wonder how you can have such a delicious meal for such little money .
restaurants,The wine list is excellent .
restaurants,"Ive been to many Thai restaurants in Manhattan before  and Toons is by far the best Thai food Ive had -LRB- except for my mom ""s"" of course -RRB- ."
restaurants,They wouldnt even let me finish my glass of wine before offering another .
restaurants,Whem asked  we had to ask more detailed questions so that we knew what the specials were .
restaurants,This is a consistently great place to dine for lunch or dinner .
restaurants,Nice atmosphere  the service was very pleasant and the desert was good .
restaurants,After really enjoying ourselves at the bar we sat down at a table and had dinner .
restaurants,Fabulous service  fantastic food  and a chilled out atmosphere and environment .
restaurants,Try the lasagnette appetizer .
restaurants,I liked the beer selection !
restaurants,Great food  good size menu  great service and an unpretensious setting .
restaurants,Go here for a romantic dinner but not for an all out wow dining experience .
restaurants,I grew up eating Dosa and have yet to find a place in NY to satisfy my taste buds .
restaurants,Wine list selection is good and wine-by-the-glass was generously filled to the top .
restaurants,With the great variety on the menu  I eat here often and never get bored .
restaurants,The menu is very limited - i think we counted 4 or 5 entrees .
restaurants,The menu is limited but almost all of the dishes are excellent .
restaurants,Not too crazy about their sake martini .
restaurants,Great bagels  spreads and a good place to hang out in .
restaurants,One thing I liked about this place is that I never felt rushed or pressured to give up my table ot incoming guests .
restaurants,Unfortunately  the food is outstanding  but everything else about this restaurant is the pits .
restaurants,We always have a delicious meal and always leave feeling satisfied .
restaurants,Dip the ingredients in with your chopsticks  swirl them around  and eat .
restaurants,First went here to enjoy their garden terrace .
restaurants,The pizza was pretty good and huge .
restaurants,"The cuisine from what I ""ve"" gathered is authentic Taiwanese  though its very different from what I ""ve"" been accustomed to in Taipei ."
restaurants,I almost hesititate to write a review because the atmosphere was so great and I would hate for it too become to crowded .
restaurants,They are often crowded on the weekends but they are efficient and accurate with their service .
restaurants,All my co-workers were amazed at how small the dish was .
restaurants,The atmosphere is unheralded  the service impecible  and the food magnificant .
restaurants,We ordered the special  grilled branzino  that was so infused with bone  it was difficult to eat .
restaurants,The wait staff is friendly  and the food has gotten better and better !
restaurants,It may be a bit packed on weekends  but the vibe is good and it is the best French food you will find in the area .
restaurants,Right off the L in Brooklyn this is a nice cozy place with good pizza .
restaurants,Le Pere Pinard has a $ 15 pre-theater menu that is outstanding .
restaurants,I also ordered for delivery and the restaurant forgot half the order .
restaurants,Our server checked on us maybe twice during the entire meal .
restaurants,The strong scents coming from the left and right of me negatively affected my taste buds .
restaurants,We had the lobster sandwich and it was FANTASTIC .
restaurants,"Had we been stalling I could understand where they were coming from  but we had been there less than an hour and they had ""nt"" even brought us a check yet !"
restaurants,Though the Spider Roll may look like a challenge to eat  with soft shell crab hanging out of the roll  it is well worth the price you pay for them .
restaurants,Deep Fried Skewers are good and still rare to find in NYC .
restaurants,"I have tried to make reservations  but both times  the hostess did ""nt"" have my name ."
restaurants,I also recommend the rice dishes or the different varieties of congee -LRB- rice porridge -RRB- .
restaurants,Their tuna tartar appetizer is to die for .
restaurants,"An oasis of refinement : Food  though somewhat uneven  often reaches the pinnacles of new American fine cuisine - chef ""s"" passion -LRB- and kitchen ""s"" precise execution -RRB- is most evident in the fish dishes and soups ."
restaurants,"If you love wine and cheese and delicious french fare  you ""ll"" love Artisanal !"
restaurants,I love Indian food and consider myself to be quite an expert on it .
restaurants,Some baby pizzas get their wish .
restaurants,Overall A oh ya even though there is waiting it is deff worth it
restaurants,The lava cake dessert was incredible and I recommend it .
restaurants,VT is what baby pizzas hope to be when they grow up .
restaurants,From the terrible service  to the bland food  not to mention the unaccommodating managers  the overall experience was horrible .
restaurants,"Lahore is a great place to duck into late-night when you need some really tasty food on the cheap -- you ""ll"" likely have trouble finishing the amount of food you get for FOUR DOLLARS ."
restaurants,The last time I went we were seated at a table in a corridor next to the kitchen .
restaurants,good selection of wines ranging from affordable to high end .
restaurants,Nice restaurant overall  with classic upscale Italian decor .
restaurants,Not impressed with the food .
restaurants,The entire dining experience was wonderful !
restaurants,"The wine selection -LRB- by the glass and bottle -RRB- is wonderful and I always recommend that friends make a reservation if they ""re"" going to be in town ."
restaurants,"Service is highly refined : our seating was delayed 35 minutes past our reservation and the maitre ""d"" apologized and regularly kept us apprised of progress ."
restaurants,"Order the panang duck  it ""s"" fantastic ."
restaurants,Food is usually very good  though ocasionally I wondered about freshmess of raw vegatables in side orders .
restaurants,"Other than the crappy service from two individuals  it ""s"" great ."
restaurants,They have authentic Indian at amazin prices .
restaurants,Ambiance - relaxed and stylish .
restaurants,Luckily we saved room for the BBQ Salmon  Sea Bass and Crispy Duck .
restaurants,"Yes  they use fancy ingredients  but even fancy ingredients do ""nt"" make for good pizza unless someone knows how to get the crust right ."
restaurants,and yes Dal Bukhara is so dam good and so are all the kababs .
restaurants,I look forward to eating here again
restaurants,"I ""ve"" been coming here as a child and always come back for the taste ."
restaurants,Tuk Tuk is one of those comfortable neighborhood joints where you know you will always have a good meal at a fair price .
restaurants,A glass of Leaping Lizard  a glass of prosecco  and the mussels had everything happy .
restaurants,Food was average and creme brulee was awful - the sugar was charred  not caramelized and smelled of kerosene .
restaurants,The food always tastes fresh and served promptly .
restaurants,The pizza here is delicious .
restaurants,Pizza and garlic knots are great as well  I order from them quite often and the delivery is always super quick !
restaurants,For great chinese food nearby  you have Wu Liang Ye and Grand Sichuan just a block away .
restaurants,"But who says Murray ""s"" is anything about service ."
restaurants,This place is really trendi but they have forgotten about the most important part of a restaurant  the food .
restaurants,Hats off to the chef .
restaurants,Service could be improved but overall this is a place that understands the importance of little things -LRB- the heavy  black  antique-seeming teapot  for one -RRB- in the restaurant experience .
restaurants,"The pizza is delicious - they use fresh mozzarella instead of the cheap  frozen  shredded cheese common to most pizzaria ""s"" ."
restaurants,Its an excellent place to relax and the food is one of the best in the city of New York .
restaurants,service is friendly  and never had a problem walking in and getting a table .
restaurants,The atmosphere was crowded but it was a great bistro-type vibe .
restaurants,First off  the waitress was completely unattentive the 2 times we saw her -LRB- odd in a restaurant with 6 tables -RRB- and got our order wrong .
restaurants,The food was bland oily .
restaurants,What is even better  is that the prices are very affordable as well  and the food is really good .
restaurants,The fish is fresh but the variety of fish is nothing out of ordinary .
restaurants,Our favorite meal is a pesto pizza  the house salad  and a good bottle of wine .
restaurants,And Kruno  the beverage manager is the best bartender I have yet to come across .
restaurants,Ambiance and music funky  which I enjoy .
restaurants,The food  drinks and service are clearly among the best in the city .
restaurants,I went there in late afternoon for some bite size food and refleshment with my date .
restaurants,I understand the area and folks you need not come here for the romantic  alluring ambiance or the five star service featuring a sommlier and a complicated maze of captain and back waiters - you come for the authentic foods  the tastes  the experiance .
restaurants,"Last time I went here  the waitress did ""nt"" come back after taking our order ."
restaurants,Try the tandoori salmon !
restaurants,"Eating in  the atmosphere saves it  but at your desk  it ""s"" a very disappointing experience ."
restaurants,Granted the space is smaller than most  it is the best service you will find in even the largest of restaurants .
restaurants,I love the atmorphere @ peep !
restaurants,The service was attentive and her suggestions of menu items was right on the mark .
restaurants,The other night we had the $ 30 three course meal and everything was delicious - if I could of licked the plate clean I would of .
restaurants,"Even after getting pushed out by the no-class Famous Ray ""s""  Sal has risen again to carry on his father ""s"" uncle ""s"" legacies with a smile  true love for his community  and let ""s"" not forget the Outstanding Pizza !"
restaurants,The environment is romantic  but the food is horrible  the service is pathetic  and gabriella lies about everything she could .
restaurants,We had crawfish boiled and despite making a mess  it was a ton of fun and quite tasty as well .
restaurants,I had very high expectations for this place and made a reservation a couple of months in advance for a special occasion .
restaurants,What came to our table was burned beyond recognition and stringy .
restaurants,I had the Pad Thai and the noodles were sticky .
restaurants,"So I ""ve"" never actually been to M proper  but I ""ve"" had it delivered a few times ."
restaurants,Among all of the new 5th avenue restaurants  this offers by far one of the best values for your money .
restaurants,Frankly  when you compare what you can have here for lunch  versus McDs or so many other sandwich shops in the city  there is no comparison .
restaurants,The hostess is rude to the point of being offensive .
restaurants,"If you ""re"" craving for Haru ""s"" great food  especially the House Roll  but ca ""nt"" stand the wait building outisde  head across the street to their Sake Bar !"
restaurants,A narrow corridor leads to a tiny space where there are three tiny white tiled counters  a great deal of mess -LRB- stacks of bottles  cans -RRB- and a small counter holding 12-14 entrees .
restaurants,The food is great .
restaurants,"Succulent steaks cooked precisely to your desired ` doneness """" accompanied by salads and sides that do ""nt"" look like leafy road kill ."
restaurants,Lunch came with pickels and slaw  no extra charge .
restaurants,Decent wine at reasonable prices .
restaurants,All conveniently delivered right to the door .
restaurants,even the wine by the glass was good .
restaurants,would have rather tried terrace in the sky or water club for that price
restaurants,This dish is my favorite and I always get it when I go there and never get tired of it .
restaurants,I also ordered the Change Mojito  which was out of this world .
restaurants,Okay service .
restaurants,The only thing more wonderful than the food -LRB- which is exceptional -RRB- is the service .
restaurants,The food was just awful  ATROCIOUS actually .
restaurants,The soup for the udon was soy sauce and water .
restaurants,The anti-pasta was excellent  especially the calamari  as were the filling pasta mains .
restaurants,The waitress suggested glasses of wine that went very well with the food .
restaurants,They might be all business at the counter when you give your order  but their food says I love you .
restaurants,We are very particular about sushi and were both please with every choice which included : ceviche mix -LRB- special -RRB-  crab dumplings  assorted sashimi  sushi and rolls  two types of sake  and the banana tempura .
restaurants,Try their plain pizza with fresh garlic or eggplant .
restaurants,"Ok  so the servers wander around a little clueless  but there ""s"" more than enough servers for the crowd they get -- it ""s"" fine  you just have to make a small effort to get their attention ."
restaurants,Good luck getting a table .
restaurants,The service is awful .
restaurants,"The takeout menu says to keep an eye out for an expanded menu offering more italian dishes  I ca ""nt"" wait !"
restaurants,I am not the most experienced person when it comes to Thai food  but my friend who took me there is .
restaurants,Regardless of whether there are two people or two hundred people ahead of you the hostess will take your name and tell you Five minutes .
restaurants,The pizza is good though .
restaurants,bottles of wine are cheap and good .
restaurants,The have over 100 different beers to offer thier guest so that made my husband very happy and the food was delicious  if I must recommend a dish it must be the pumkin tortelini .
restaurants,"They did ""nt"" give us the dinner special until we asked for it ."
restaurants,You must have the crabmeat lasagna which is out of this world and the chocolate bread pudding for dessert .
restaurants,"word of advice  save room for pasta dishes and never leave until you ""ve"" had the tiramisu ."
restaurants,Very good service and very good prices .
restaurants,I recently went to this restaurant with some co-workers for lunch and had an amazing time .
restaurants,The service was impeccable and unobtrusive -- the staff knows what they are there to do -- to know their menu  present your meal  and attend to your needs .
restaurants,Ess-A-Bagel -LRB- either by Sty-town or midtown -RRB- is by far the best bagel in NY .
restaurants,Our food was great too !
restaurants,The most annoying thing  though  is the fact that the servers seem to be trained to drive revenue .
restaurants,Get your food to go  find a bench  and kick back with a plate of dumplings .
restaurants,Please try the Filet Mignon  its just the most tender piece ever .
restaurants,We were still sitting at the bar while we drank the sangria  but facing away from the bar when we turned back around  the $ 2 was gone the people next to us said the bartender took it .
restaurants,The sake menu should not be overlooked !
restaurants,the drinks are amazing and half off till 8pm .
restaurants,"i ""ve"" been back to nha trang literally a hundred times for the beef cubes - they ""re"" that good ."
restaurants,The service  wine selection  ambiance are all outstanding and deserve recognition .
restaurants,We were seated promptly as we had reservations  however after that the service was slow .
restaurants,"It ""s"" really also the service  is good and the waiters are friendly ."
restaurants,The food was pretty good  but a little flavorless and the portions very small  including dessert .
restaurants,"It is set far from the small street it ""s"" on  and there is no traffic noise ."
restaurants,Lived in Shanghai most of my life and thought the food was comparable to the flagship Green Bo restaurant there .
restaurants,"I highly recommend Cafe St. Bart ""s"" for their food  the ambience and wonderful service ."
restaurants,This is a nice restaurant if you are looking for a good place to host an intimate dinner meeting with business associates .
restaurants,All the NYU students love this place so it makes for a fun young atmosphere .
restaurants,The food here does a great service to the name -LRB- Cantonese that is ... -RRB- .
restaurants,But  nothing stands out about the cooking .
restaurants,Joya used to be a cool spot with decent food and a colorful - if not relaxed - atmosphere .
restaurants,The Prix Fixe menu is worth every penny and you get more than enough -LRB- both in quantity AND quality -RRB- .
restaurants,"I ""ve"" been here 3 times for lunch and it is one of my favorites in the city ."
restaurants,I had their eggs benedict for brunch  which were the worst in my entire life  I tried removing the hollondaise sauce completely that was how failed it was .
restaurants,I work near-by  and they have the BEST oatmeal in the neighborhood - not a packaged or quick-cooked item .
restaurants,"Too bad the food was ""nt"" of the same heritage ."
restaurants,The menu looked good  except for offering the Chilean Sea Bass  but the server does not offer up the specials that were written on the board outside .
restaurants,The food was really good  I had the onion soup and it was one of the best ever .
restaurants,overall  a solid restaurant and at less than $ 40pp -LRB- including wine -RRB-  a solid deal as well .
restaurants,"Since it literally is a complete hole in the wall  it ""s"" a bit intimidating at first  but you get over that very quickly as soon as the friendly staff welcomes you - do ""nt"" hesitate to ask for help with what to get ."
restaurants,Based on the reviews for dinner  this is a place I would reconsider revisiting for that  but definitely not for Dim Sum again .
restaurants,"It costs $ 2 extra to turn a regular roll into an inside-out roll  but the roll more than triples in size  and that ""s"" not just from the rice ."
restaurants,"When he finally did  he was unable to make a gin and tonic -- could ""nt"" find tonic ."
restaurants,"The dim sum is ok but does ""nt"" taste that fresh  and the little dishes do ""nt"" look steamy hot as they should -LRB- also note lack of Chinese here -RRB- ."
restaurants,"The service is ok  some of the people did ""nt"" get what they asked for ."
restaurants,If you want good authentic Thai this place is not the place to go .
restaurants,I recommend getting a reservation even though we saw people seated without one .
restaurants,The only thing I moderately enjoyed was their Grilled Chicken special with Edamame Puree .
restaurants,If you want some roast duck  pork or chicken on rice with ginger  try them out !
restaurants,You order from a menu  so you leave feeling like you missed the full experience .
restaurants,Staff is very accomodating .
restaurants,"I went to Del Frisco ""s"" Friday night with my boyfriend for an 8:00 reservation ."
restaurants,yourself a favor and have dinner here and see if you dont agree with me .
restaurants,Very popular style Izakaya -LRB- Sake and small portion of sake-friendly dishes -RRB- .
restaurants,The food was terrific and the service classy  attentive  without being overbearing .
restaurants,This is an amazing place to try some roti rolls .
restaurants,Fresh ingredients and everything is made to order .
restaurants,We have never had any problems with charging the meal or the tip  and the food was delivered quickly  but we live only a few minutes walk from them .
restaurants,Quick and friendly service .
restaurants,They are tasty  but I suggest only eating one with meat because they tend not to mesh that well with the average American digestive system .
restaurants,"Try the hot dogs too  they ""re"" snappy and delicious ."
restaurants,Delivery is fast too .
restaurants,The noise level was unbearable  conversation impossible .
restaurants,Personal pans are the perfect size for those hungry nights .
restaurants,Highly recommended is the Spicy Fried Clam Rolls and Spider Rolls .
restaurants,One of the earlier people commenting on the restaurant did not get the that some experimenting is going on with the menu in a positive way .
restaurants,The atmosphere is great if your looking for a laid back scene and an inexpensive way to spend a weekend afternoon .
restaurants,Odd for Ave B  not just odd  The place attracts an eclectic crowd to say the least .
restaurants,Instead of wasting your time here : SUPPORT RESTAURANTS THAT CARE ABOUT FOOD .
restaurants,just got back from lunch at Tamarind and it was excellent .
restaurants,"head and shoulders above its neighboors on east 6 st  taj mahal is also very comparable  in food quality  to the much overpraised -LRB- and underdeserving -RRB- baluchi ""s"" ."
restaurants,The man that was hosting promised to save a table for our party of 7  then sat a party of 2 at the very table he was saving -LRB- mean while there were boths open all around -RRB- .
restaurants,Try the cheesecake !
restaurants,As we were sitting eating the subpar food the manager proceeded to berate a couple of his employees for putting out the wrong containers for condiments and explained to them how expensive these containers were .
restaurants,Great Indian food and the service is incredible .
restaurants,Decor is nice and minimalist  food simple yet very well presented and cooked  and the wine list matches the food very well .
restaurants,I had the salmon dish and while it was fine  for the price paid  I expected it to have some type of flavor .
restaurants,We ordered a tuna melt - it came with out cheese which just made it a tuna sandwich .
restaurants,Especially liked chicken tikka and the naan  and the dals .
restaurants,The waiters were not attentive except that the bill turned up on the table before we were finished .
restaurants,The restaurant looks out over beautiful green lawns to the Hudson River and the Statue of Liberty .
restaurants,The sangria was pretty tasty and good on a hot muggy day .
restaurants,"Do ""nt"" eat here unless you ""re"" starving for thai food and you work next door ."
restaurants,For the people who want great food plus great service  Roxy is a place to AVOID !
restaurants,I had the best ravioli ever .
restaurants,Ive been here a bunch of times now and the service is always outstanding .
restaurants,The bill is approximately $ 25 for 2 at lunch without drinks .
